{
  "version": 1,
  "mode": "dark",
  "colors": {
    "canvas": "#09090B",
    "surface": "#111111",
    "card": "#18181B",
    "textPrimary": "#F8FAFC",
    "textMuted": "#D4D4D8",
    "textSubtle": "#A1A1AA",
    "textInverse": "#FFFFFF",
    "stroke": "#27272A",
    "strokeSoft": "#1F1F23",
    "grid": "#27272A",
    "darkCanvas": "#09090B",
    "darkPanel": "#111111",
    "darkText": "#FAFAFA",
    "darkMutedText": "#D4D4D8",
    "darkBorder": "#27272A",
    "darkCallout": "#18181B",
    "signalPrimary": "#F59E0B",
    "signalPrimaryTint": "#2A1A05",
    "signalPrimaryBorder": "#92400E",
    "signalSecondary": "#F97316",
    "signalSecondaryTint": "#2B1206",
    "signalSecondaryBorder": "#9A3412",
    "signalTertiary": "#FBBF24",
    "signalTertiaryTint": "#2A2008",
    "signalTertiaryBorder": "#A16207",
    "signalRisk": "#F87171",
    "signalRiskTint": "#2A0C0C",
    "signalRiskBorder": "#991B1B",
    "signalWarning": "#FBBF24",
    "signalWarningTint": "#2A2008",
    "signalWarningBorder": "#A16207",
    "signalSuccess": "#34D399",
    "signalSuccessTint": "#052E24",
    "signalSuccessBorder": "#047857",
    "signalNeutral": "#A1A1AA",
    "signalNeutralTint": "#18181B",
    "signalNeutralBorder": "#3F3F46",
    "entityPrimary": "#F59E0B",
    "entityPrimaryTint": "#2A1A05",
    "entityPrimaryBorder": "#92400E",
    "entitySecondary": "#F97316",
    "entitySecondaryTint": "#2B1206",
    "entitySecondaryBorder": "#9A3412",
    "chart1": "#F59E0B",
    "chart2": "#F97316",
    "chart3": "#FBBF24",
    "chart4": "#F87171",
    "chart5": "#34D399",
    "chart6": "#A1A1AA",
    "chartStructureSegment1": "#3F3F46",
    "chartStructureSegment2": "#F59E0B",
    "chartStructureSegment3": "#F97316"
  },
  "shadows": {
    "card": "0 10px 24px rgba(0,0,0,0.38)",
    "panel": "0 18px 36px rgba(0,0,0,0.46)",
    "darkPanel": "0 18px 36px rgba(0,0,0,0.5)",
    "soft": "0 8px 18px rgba(0,0,0,0.34)"
  }
}
