{
  "version": 1,
  "mode": "light",
  "colors": {
    "canvas": "#FFFFFF",
    "surface": "#F8FAFC",
    "card": "#FFFFFF",
    "textPrimary": "#1E293B",
    "textMuted": "#94A3B8",
    "textSubtle": "#64748B",
    "textInverse": "#FFFFFF",
    "stroke": "#E2E8F0",
    "strokeSoft": "#F1F5F9",
    "grid": "#F1F5F9",
    "darkCanvas": "#0F172A",
    "darkPanel": "#1E293B",
    "darkText": "#F8FAFC",
    "darkMutedText": "#CBD5E1",
    "darkBorder": "#334155",
    "darkCallout": "#334155",
    "signalPrimary": "#2563EB",
    "signalPrimaryTint": "#EFF6FF",
    "signalPrimaryBorder": "#BFDBFE",
    "signalSecondary": "#14B8A6",
    "signalSecondaryTint": "#F0FDFA",
    "signalSecondaryBorder": "#99F6E4",
    "signalTertiary": "#4F46E5",
    "signalTertiaryTint": "#EEF2FF",
    "signalTertiaryBorder": "#C7D2FE",
    "signalRisk": "#F43F5E",
    "signalRiskTint": "#FFF1F2",
    "signalRiskBorder": "#FECDD3",
    "signalWarning": "#D97706",
    "signalWarningTint": "#FFFBEB",
    "signalWarningBorder": "#FDE68A",
    "signalSuccess": "#22C55E",
    "signalSuccessTint": "#F0FDF4",
    "signalSuccessBorder": "#BBF7D0",
    "signalNeutral": "#475569",
    "signalNeutralTint": "#F1F5F9",
    "signalNeutralBorder": "#CBD5E1",
    "entityPrimary": "#2563EB",
    "entityPrimaryTint": "#EFF6FF",
    "entityPrimaryBorder": "#BFDBFE",
    "entitySecondary": "#14B8A6",
    "entitySecondaryTint": "#F0FDFA",
    "entitySecondaryBorder": "#99F6E4",
    "chart1": "#2563EB",
    "chart2": "#14B8A6",
    "chart3": "#4F46E5",
    "chart4": "#F43F5E",
    "chart5": "#D97706",
    "chart6": "#64748B",
    "chartStructureSegment1": "#CBD5E1",
    "chartStructureSegment2": "#475569",
    "chartStructureSegment3": "#F43F5E"
  },
  "shadows": {
    "card": "0 4px 8px rgba(15,23,42,0.05)",
    "panel": "0 8px 18px rgba(15,23,42,0.08)",
    "darkPanel": "0 10px 18px rgba(15,23,42,0.18)",
    "soft": "0 2px 7px rgba(15,23,42,0.05)"
  }
}
