{
  "version": 1,
  "mode": "light",
  "colors": {
    "canvas": "#FFFFFF",
    "surface": "#F8FAFC",
    "card": "#FFFFFF",
    "textPrimary": "#1F2937",
    "textMuted": "#94A3B8",
    "textSubtle": "#64748B",
    "textInverse": "#FFFFFF",
    "stroke": "#E5E7EB",
    "strokeSoft": "#F3F4F6",
    "grid": "#F3F4F6",
    "darkCanvas": "#111827",
    "darkPanel": "#1F2937",
    "darkText": "#F9FAFB",
    "darkMutedText": "#D1D5DB",
    "darkBorder": "#374151",
    "darkCallout": "#374151",
    "signalPrimary": "#B45309",
    "signalPrimaryTint": "#FFFBEB",
    "signalPrimaryBorder": "#FDE68A",
    "signalSecondary": "#0F766E",
    "signalSecondaryTint": "#F0FDFA",
    "signalSecondaryBorder": "#99F6E4",
    "signalTertiary": "#7C3AED",
    "signalTertiaryTint": "#F5F3FF",
    "signalTertiaryBorder": "#DDD6FE",
    "signalRisk": "#DC2626",
    "signalRiskTint": "#FEF2F2",
    "signalRiskBorder": "#FECACA",
    "signalWarning": "#D97706",
    "signalWarningTint": "#FFFBEB",
    "signalWarningBorder": "#FDE68A",
    "signalSuccess": "#16A34A",
    "signalSuccessTint": "#F0FDF4",
    "signalSuccessBorder": "#BBF7D0",
    "signalNeutral": "#4B5563",
    "signalNeutralTint": "#F3F4F6",
    "signalNeutralBorder": "#D1D5DB",
    "entityPrimary": "#B45309",
    "entityPrimaryTint": "#FFFBEB",
    "entityPrimaryBorder": "#FDE68A",
    "entitySecondary": "#0F766E",
    "entitySecondaryTint": "#F0FDFA",
    "entitySecondaryBorder": "#99F6E4",
    "chart1": "#B45309",
    "chart2": "#0F766E",
    "chart3": "#7C3AED",
    "chart4": "#DC2626",
    "chart5": "#2563EB",
    "chart6": "#64748B",
    "chartStructureSegment1": "#D1D5DB",
    "chartStructureSegment2": "#4B5563",
    "chartStructureSegment3": "#DC2626"
  },
  "shadows": {
    "card": "0 4px 8px rgba(31,41,55,0.05)",
    "panel": "0 8px 18px rgba(31,41,55,0.08)",
    "darkPanel": "0 10px 18px rgba(17,24,39,0.22)",
    "soft": "0 2px 7px rgba(31,41,55,0.06)"
  }
}
